{
  "$schema": "https://json-schema.org/draft/2020-12/schema",
  "$id": "https://github.com/Preponderous-Software/playtester/src/playtester/data/schemas/profile.schema.json",
  "title": "Playtester game profile",
  "description": "Everything the harness needs to know about one game (docs/PROFILES.md).",
  "type": "object",
  "additionalProperties": false,
  "required": [
    "name",
    "title",
    "description",
    "launch",
    "window"
  ],
  "properties": {
    "$comment": {
      "type": "string"
    },
    "name": {
      "type": "string",
      "pattern": "^[a-z0-9][a-z0-9-]*$"
    },
    "title": {
      "type": "string",
      "minLength": 1,
      "description": "The game's name, as agents should call it"
    },
    "description": {
      "type": "string",
      "minLength": 1,
      "description": "One sentence an agent reads first"
    },
    "repository": {
      "type": "string",
      "description": "owner/name on GitHub, for issues and evidence"
    },
    "build": {
      "type": "object",
      "additionalProperties": false,
      "required": [
        "command"
      ],
      "properties": {
        "command": {
          "type": "string",
          "description": "Shell command, run in the game's checkout, that builds what launch.command runs"
        },
        "requires": {
          "type": "array",
          "items": {
            "type": "string"
          },
          "description": "Tools the build needs on PATH"
        }
      }
    },
    "launch": {
      "type": "object",
      "additionalProperties": false,
      "required": [
        "command"
      ],
      "properties": {
        "command": {
          "type": "array",
          "minItems": 1,
          "items": {
            "type": "string"
          }
        },
        "args": {
          "type": "array",
          "items": {
            "type": "string"
          },
          "description": "Always passed after command"
        },
        "cwd": {
          "type": "string"
        },
        "env": {
          "type": "object",
          "additionalProperties": {
            "type": "string"
          }
        },
        "env_defaults": {
          "type": "object",
          "additionalProperties": {
            "type": "string"
          },
          "description": "Set only when unset and the value is an existing path"
        },
        "seed_args": {
          "type": "array",
          "items": {
            "type": "string"
          },
          "description": "Passed when pt start --seed S is given; {seed} is S"
        },
        "quick_world_args": {
          "type": "array",
          "items": {
            "type": "string"
          },
          "description": "Arguments that start straight in a world (pt measure)"
        },
        "start_timeout_sec": {
          "type": "number",
          "minimum": 1
        },
        "settle_sec": {
          "type": "number",
          "minimum": 0,
          "description": "Seconds to wait after the window appears, for games whose first frames are blank"
        },
        "lp_threads": {
          "type": "integer",
          "minimum": 1,
          "description": "llvmpipe threads per game (LP_NUM_THREADS) unless PT_LP_THREADS is set; default 2"
        }
      }
    },
    "window": {
      "type": "object",
      "additionalProperties": false,
      "required": [
        "title_regex"
      ],
      "properties": {
        "title_regex": {
          "type": "string",
          "minLength": 1,
          "description": "xdotool search --name pattern for the game's window"
        },
        "width": {
          "type": "integer",
          "minimum": 64
        },
        "height": {
          "type": "integer",
          "minimum": 64
        }
      }
    },
    "probe": {
      "type": [
        "object",
        "null"
      ],
      "additionalProperties": false,
      "required": [
        "flag",
        "ticks_per_second"
      ],
      "properties": {
        "flag": {
          "type": "string",
          "description": "The game's option taking the probe directory, e.g. --playtest-out"
        },
        "ticks_per_second": {
          "type": "number",
          "minimum": 1,
          "description": "Simulation ticks per second of game time"
        },
        "world_screens": {
          "type": "array",
          "items": {
            "type": "string"
          },
          "description": "Screens on which face and walkto work (default WORLD)"
        },
        "screens": {
          "type": "array",
          "items": {
            "type": "string"
          },
          "description": "The screen names the game reports, for agents"
        },
        "since": {
          "type": "string",
          "description": "The first game version or commit with the probe"
        }
      }
    },
    "movement": {
      "type": [
        "object",
        "null"
      ],
      "additionalProperties": false,
      "required": [
        "turn"
      ],
      "properties": {
        "turn": {
          "anyOf": [
            {
              "type": "object",
              "additionalProperties": false,
              "required": [
                "method",
                "left",
                "right",
                "degrees_per_second"
              ],
              "properties": {
                "method": {
                  "const": "keys"
                },
                "left": {
                  "type": "string"
                },
                "right": {
                  "type": "string"
                },
                "degrees_per_second": {
                  "type": "number",
                  "minimum": 1
                }
              }
            },
            {
              "type": "object",
              "additionalProperties": false,
              "required": [
                "method",
                "pixels_per_degree"
              ],
              "properties": {
                "method": {
                  "const": "mouse"
                },
                "pixels_per_degree": {
                  "type": "number",
                  "description": "Relative pointer pixels per degree turned right (negative if moving right turns left)"
                }
              }
            }
          ]
        },
        "yaw_increases": {
          "enum": [
            "left",
            "right"
          ],
          "description": "Which way state.json's player.yawDeg grows when the player turns"
        },
        "forward_key": {
          "type": "string"
        },
        "speed_field": {
          "type": "string",
          "description": "The player field with the walking speed (default speed)"
        },
        "default_speed": {
          "type": "number",
          "minimum": 0.01
        },
        "interact_key": {
          "type": "string"
        },
        "interact_range": {
          "type": "number",
          "minimum": 0
        },
        "stop_distance": {
          "type": "number",
          "minimum": 0,
          "description": "walkto stops closer than this"
        },
        "face_tolerance": {
          "type": "number",
          "minimum": 0
        },
        "nearest_kinds": {
          "type": "array",
          "items": {
            "type": "string"
          }
        }
      }
    },
    "crash_patterns": {
      "type": "array",
      "items": {
        "type": "string"
      },
      "description": "Regular expressions that mark a crash in game.log"
    },
    "process_name": {
      "type": "string",
      "description": "What pgrep -f matches for a running game, for cleanup checks"
    },
    "agent_notes": {
      "type": "string",
      "description": "Markdown file (relative to the profile) with controls and tips for agents"
    },
    "cheats": {
      "type": "string",
      "description": "What agents must not press or pass unless their goal says so"
    },
    "smoke": {
      "type": "object",
      "additionalProperties": false,
      "required": [
        "steps"
      ],
      "properties": {
        "description": {
          "type": "string"
        },
        "seed": {
          "type": [
            "integer",
            "string"
          ]
        },
        "args": {
          "type": "array",
          "items": {
            "type": "string"
          }
        },
        "steps": {
          "type": "array",
          "items": {
            "type": "array",
            "minItems": 1,
            "items": {
              "type": "string"
            }
          }
        },
        "until": {
          "type": "object",
          "additionalProperties": false,
          "required": [
            "event",
            "steps"
          ],
          "properties": {
            "event": {
              "type": "object"
            },
            "attempts": {
              "type": "integer",
              "minimum": 1
            },
            "steps": {
              "type": "array",
              "items": {
                "type": "array",
                "minItems": 1,
                "items": {
                  "type": "string"
                }
              }
            },
            "may_fail": {
              "type": "array",
              "items": {
                "type": "string"
              },
              "description": "Commands whose failure only ends this attempt"
            }
          }
        }
      }
    },
    "goals": {
      "type": "array",
      "items": {
        "type": "object",
        "additionalProperties": false,
        "required": [
          "goal"
        ],
        "properties": {
          "goal": {
            "type": "string",
            "minLength": 1
          },
          "budget_min": {
            "type": "number",
            "minimum": 1
          },
          "seed": {
            "type": [
              "integer",
              "string"
            ]
          },
          "args": {
            "type": "array",
            "items": {
              "type": "string"
            }
          }
        }
      }
    },
    "evidence_dir": {
      "type": "string",
      "description": "Where in the game's repository playtest evidence is committed (default docs/playtests)"
    }
  }
}
